{
  "$schema": "https://json-schema.org/draft/2020-12/schema",
  "$id": "https://thirdi.net/schemas/portal/roadmap.schema.json",
  "title": "Partnership roadmap",
  "description": "A 12-month visual partnership plan shown on the AI Roadmap page. Per-client, shared schema. Shows the ongoing relationship — monthly deliverables, milestone expansions, and long-term value.",
  "type": "object",
  "required": ["schemaVersion", "tenant", "clientSafe", "asOf", "startMonth", "cadence", "months", "source"],
  "properties": {
    "schemaVersion": { "type": "string", "const": "2.0.0" },
    "tenant": { "$ref": "common.schema.json#/$defs/tenant" },
    "clientSafe": { "type": "boolean", "const": true },
    "asOf": { "$ref": "common.schema.json#/$defs/isoDate" },
    "startMonth": {
      "type": "string",
      "pattern": "^[0-9]{4}-[0-9]{2}$",
      "description": "The month the client relationship began (YYYY-MM). The roadmap starts here and spans 12 months forward."
    },
    "cadence": {
      "type": "object",
      "description": "Recurring monthly deliverable cadence, tailored per client based on work history.",
      "required": ["deliverable", "frequency", "amount"],
      "properties": {
        "deliverable": { "$ref": "common.schema.json#/$defs/nonEmptyText", "description": "What is delivered each cycle (e.g., '30-second video', '1-minute film')." },
        "frequency": { "type": "string", "enum": ["monthly"], "description": "How often the recurring deliverable is produced." },
        "amount": { "$ref": "common.schema.json#/$defs/nonEmptyText", "description": "The size or scope of each deliverable (e.g., '30 seconds', '1 minute')." }
      }
    },
    "months": {
      "type": "array",
      "description": "12 monthly entries from the start month. Each month shows what Third i is delivering and any milestone expansions.",
      "minItems": 12,
      "maxItems": 12,
      "items": {
        "type": "object",
        "required": ["month", "label", "status", "items"],
        "properties": {
          "month": {
            "type": "integer",
            "minimum": 1,
            "maximum": 12,
            "description": "Month number (1 = start month)."
          },
          "label": { "$ref": "common.schema.json#/$defs/nonEmptyText", "description": "Human-readable month label (e.g., 'July 2026', 'August 2026')." },
          "status": {
            "type": "string",
            "enum": ["done", "current", "upcoming"],
            "description": "Whether this month is in the past, current, or future."
          },
          "items": {
            "type": "array",
            "description": "What Third i is delivering or expanding into this month.",
            "items": {
              "type": "object",
              "required": ["type", "title", "description"],
              "properties": {
                "type": {
                  "type": "string",
                  "enum": ["film", "ai-workflows", "value-audit", "expansion", "other"],
                  "description": "The kind of work this item represents. Drives the SVG icon shown in the infographic."
                },
                "title": { "$ref": "common.schema.json#/$defs/nonEmptyText", "description": "Short title shown on the infographic card." },
                "description": { "$ref": "common.schema.json#/$defs/nonEmptyText", "description": "One-sentence plain-English explanation of what this item delivers." },
                "milestone": { "type": "boolean", "default": false, "description": "True if this is a milestone expansion (Month 2, 4, 6+), not a recurring deliverable." }
              }
            }
          }
        }
      }
    },
    "milestones": {
      "type": "array",
      "description": "Summary of the key milestone expansions, shown as callouts on the infographic.",
      "items": {
        "type": "object",
        "required": ["month", "title", "description"],
        "properties": {
          "month": { "type": "integer", "minimum": 1, "maximum": 12 },
          "title": { "$ref": "common.schema.json#/$defs/nonEmptyText" },
          "description": { "$ref": "common.schema.json#/$defs/nonEmptyText" }
        }
      }
    },
    "source": { "$ref": "common.schema.json#/$defs/source" }
  }
}
