{
  "schemaVersion": "2.0.0",
  "tenant": "bkwatch",
  "clientSafe": true,
  "asOf": "2026-07-16",
  "startMonth": "2026-07",
  "cadence": {
    "deliverable": "30-second video",
    "frequency": "monthly",
    "amount": "30 seconds"
  },
  "months": [
    {
      "month": 1,
      "label": "July 2026",
      "status": "current",
      "items": [
        { "type": "film", "title": "Film 1 — Final Demo", "description": "The first 30-second film showing how bankruptcy automation works inside Spectrum.", "milestone": false }
      ]
    },
    {
      "month": 2,
      "label": "August 2026",
      "status": "upcoming",
      "items": [
        { "type": "film", "title": "Film 2", "description": "The next 30-second video, building on the visual system established in Film 1.", "milestone": false },
        { "type": "ai-workflows", "title": "AI Workflows & Agents", "description": "Teaching and implementing AI-powered workflows and agents to automate routine tasks.", "milestone": true }
      ]
    },
    {
      "month": 3,
      "label": "September 2026",
      "status": "upcoming",
      "items": [
        { "type": "film", "title": "Film 3", "description": "The next 30-second video in the monthly series.", "milestone": false }
      ]
    },
    {
      "month": 4,
      "label": "October 2026",
      "status": "upcoming",
      "items": [
        { "type": "film", "title": "Film 4", "description": "The next 30-second video in the monthly series.", "milestone": false },
        { "type": "value-audit", "title": "Value Audit & Improvement Plan", "description": "A full review of what Third i has delivered so far, with a plan to increase value and efficiency going forward.", "milestone": true }
      ]
    },
    {
      "month": 5,
      "label": "November 2026",
      "status": "upcoming",
      "items": [
        { "type": "film", "title": "Film 5", "description": "The next 30-second video in the monthly series.", "milestone": false }
      ]
    },
    {
      "month": 6,
      "label": "December 2026",
      "status": "upcoming",
      "items": [
        { "type": "film", "title": "Film 6", "description": "The next 30-second video in the monthly series.", "milestone": false },
        { "type": "expansion", "title": "Expanded Partnership", "description": "New service areas: client and partner integrations, website assets, presentations, and conference materials.", "milestone": true }
      ]
    },
    {
      "month": 7,
      "label": "January 2027",
      "status": "upcoming",
      "items": [
        { "type": "film", "title": "Film 7", "description": "The next 30-second video in the monthly series.", "milestone": false },
        { "type": "expansion", "title": "On-Call Creative Support", "description": "Available as an on-call partner for future film needs, website improvements, and creative projects.", "milestone": false }
      ]
    },
    {
      "month": 8,
      "label": "February 2027",
      "status": "upcoming",
      "items": [
        { "type": "film", "title": "Film 8", "description": "The next 30-second video in the monthly series.", "milestone": false },
        { "type": "expansion", "title": "Daily-Use AI Workflows", "description": "Custom AI workflows for everyday tasks — writing, analysis, research, and reporting.", "milestone": false }
      ]
    },
    {
      "month": 9,
      "label": "March 2027",
      "status": "upcoming",
      "items": [
        { "type": "film", "title": "Film 9", "description": "The next 30-second video in the monthly series.", "milestone": false },
        { "type": "expansion", "title": "Agentic Workflow Training", "description": "Teaching the team how to use autonomous AI workflows for their own work.", "milestone": false }
      ]
    },
    {
      "month": 10,
      "label": "April 2027",
      "status": "upcoming",
      "items": [
        { "type": "film", "title": "Film 10", "description": "The next 30-second video in the monthly series.", "milestone": false }
      ]
    },
    {
      "month": 11,
      "label": "May 2027",
      "status": "upcoming",
      "items": [
        { "type": "film", "title": "Film 11", "description": "The next 30-second video in the monthly series.", "milestone": false }
      ]
    },
    {
      "month": 12,
      "label": "June 2027",
      "status": "upcoming",
      "items": [
        { "type": "film", "title": "Film 12", "description": "The next 30-second video in the monthly series.", "milestone": false },
        { "type": "value-audit", "title": "Year-End Review & Next-Year Plan", "description": "A full year-in-review showing value delivered, efficiency gained, and the plan for year two.", "milestone": true }
      ]
    }
  ],
  "milestones": [
    { "month": 2, "title": "AI Workflows & Agents", "description": "Teaching and implementing AI-powered workflows to automate routine tasks." },
    { "month": 4, "title": "Value Audit & Improvement Plan", "description": "Full review of value delivered, with a plan to increase efficiency going forward." },
    { "month": 6, "title": "Expanded Partnership", "description": "New service areas: integrations, website assets, presentations, and conference materials." },
    { "month": 12, "title": "Year-End Review", "description": "A full year-in-review and the plan for year two." }
  ],
  "source": "Third i partnership plan — tailored to bkWatch based on Film 1 work history"
}
